,source_url,title,content,index,question,answer
53,https://www.va.gov/disability/how-to-file-claim/evidence-needed/,What documents will I need to support my claim?. disability how to file claim evidence needed,"We require certain documents to support all claims for disability benefits. You’ll need to submit or give us permission to gather these: You’ll need to submit or give us permission to gather these: Your DD214 or other separation documents Your service treatment records Any medical evidence related to your illness or injury (like doctor’s reports, X-rays, and medical test results) Note:You can also choose to submit a lay witness statement (sometimes called a “buddy statement”) to support a VA claim. We’ll review this statement along with the other evidence you submit. Note: Submit a lay or witness statement online to support a claim If your records were destroyed in the 1973 NPRC fire in St. Louis In 1973, a fire at the National Personnel Records Center (NPRC) in St. Louis destroyed records held for Veterans who were discharged from the Army and Air Force during certain periods of time. If your records were destroyed in this fire, you can get help reconstructing them. Find out how to reconstruct your records If you’re a service member filing a claim through the BDD program If you’re filing a claim through the Benefits Delivery at Discharge (BDD) program, you must submit a Separation Health Assessment - Part A Self-Assessment form. If you already filed a claim but didn’t submit this form yet, you can upload the form now. Find out how to upload your completed self-assessment form",53,What specific documents will be required to support a claim for disability benefits?,"To support a claim for disability benefits, you will need to submit or give permission for the gathering of several key documents. These include your DD214 or other separation documents, service treatment records, any medical evidence related to your illness or injury like doctor's reports, X-rays, and medical test results. Additionally, you can choose to submit a lay witness statement online to support your VA claim. If your records were destroyed in the 1973 NPRC fire in St. Louis, there are options available to help reconstruct them. Service members filing a claim through the BDD program must also submit a Separation Health Assessment - Part A Self-Assessment form."
54,https://www.va.gov/disability/how-to-file-claim/evidence-needed/,What should the evidence show to support my disability claim?. disability how to file claim evidence needed,"This depends on the type of claim and on the issue or benefit you’re filing a claim for. Find your claim type here to learn what evidence you’ll need. Notice to Veterans and service members of evidence needed:We’re required by law to tell you what evidence you’ll need to provide to support your disability claim. Notice to Veterans and service members of evidence needed: The information on this page is a summary of evidence requirements (called “section 5103 notice”). You can review the official evidence requirements in VA Form 21-526EZ. Get VA Form 21-526EZ to download Type of claim you’re filing Find out what evidence you’ll need for your claim type: You’ll need to submit evidence of: You’ll need to submit evidence of: A current physical or mental disability from a medical professional,and and An event, injury, or disease that happened during your active-duty service,and and A link between your current disability and the event, injury, or disease that happened during your service. Usually we need medical records or medical opinions from health care providers to support this link. In certain situations, we may conclude that there’s a link between your military service and your disability even if there’s no evidence. This usually applies to: A chronic (long-lasting) illness that appears within a year after discharge,or or An illness caused by contact with contaminants (toxic chemicals) or other hazardous materials,or or An illness caused by your time spent as a POW You’ll need to submit current evidence from a medical professional that shows your disability has gotten worse. You’ll need to submit evidence of: You’ll need to submit evidence of: A current physical or mental disability from a medical professional,and and An event, injury, or disease that happened during your active-duty service,and and A link between your current disability and the event, injury, or disease that happened during your service. Usually, we need medical records or medical opinions from health care providers to support this link. You’ll need to submit evidence of: You’ll need to submit evidence of: The new physical or mental disability from a medical professional,and and A link between the new disability and the disability we’ve already determined is service connected. Usually we need medical records or medical opinions from health care providers to support this link. You’ll need to submit new and relevant evidence that you think will change our decision: New evidenceis information you didn’t submit to us in the past. New evidence Relevant evidenceis information that proves or disproves something in your claim. Relevant evidence We can also help you gather documents from a VA medical center, other federal facility, or your private health care provider. You'll need to provide the name of the facility that treated you and the treatment dates. You’ll need to submit or identify these types of evidence: Medical records that show the diagnosis and severity of your claimed condition,and and Military records that show you meet the service requirements for the presumption If you have qualifying military service for a presumptive condition, you don’t need to prove that your service caused the condition. We automatically assume (or “presume”) that your service caused your condition. Learn more about presumptive conditions based on exposure to toxic materials: Burn pits during Gulf War service Agent Orange during Vietnam Era service Mustard gas or lewisite Contaminated water at Camp Lejeune Ionizing radiation Learn more about different types of presumptive conditions: Certain conditions for former prisoners of war Certain illnesses linked to Gulf War service in Afghanistan Certain illnesses linked to Gulf War service in Southwest Asia Certain other illnesses diagnosed within a year after discharge Learn more about Supplemental Claims Additional evidence for certain issues Find out what evidence you can submit for a claim related to military sexual trauma (MST). Learn about evidence to support an MST claim Find out what additional evidence you’ll need if you’re filing a claim for any of these other issues: You’ll also need to submit one of these forms: You’ll also need to submit one of these forms: A completed Statement in Support of Claim for Service Connection for Post-Traumatic Stress Disorder (VA Form 21-0781)Get VA Form 21-0781 to downloador or If you’re claiming PTSD based on personal assault, a completed Statement in Support of Claim for Service Connection for Post-Traumatic Stress Disorder Secondary to Personal Assault (VA Form 21-0781a)Get VA Form 21-0781a to download Learn more about PTSD claims You’ll need to submit everything listed here: You’ll need to submit everything listed here: Medical evidence that shows a service-connected disability prevents you from getting or keeping substantially gainful employment (work that brings in enough money to earn a livelihood). Odd jobs (marginal employment) don’t count. A completed Veteran’s Application for Increased Compensation Based on Unemployability (VA Form 21-8940).Get VA Form 21-8940 to download A completed Request for Employment Information in Connection with Claim for Disability Benefits (VA Form 21-4192), completed by your last employer.Get VA Form 21-4192 to download Learn more about Individual Unemployability You’ll need to submit evidence that shows you experienced at least one of these situations at a hospital: You’ll need to submit evidence that shows you experienced at least one of these situations at a hospital: You spent more than 21 days in a VA hospital or other approved hospital for a service-connected disability,or or You were under hospital observation for more than 21 days at our expense for a service-connected disability If you had surgery, you’ll need to submit evidence that shows these descriptions are true: If you had surgery, you’ll need to submit evidence that shows these descriptions are true: Your surgery required a recovery time of at least one month (or the surgery or treatment was for a service-connected disability),and and Your surgery resulted in severe issues for you. This could include surgical wounds that haven’t totally healed, stumps or recent amputations, being unable to move due to being put in splints or casts, being unable to leave your house, or having to use a wheelchair or crutches. If you didn’t have surgery, you’ll need to show that one or more of your major joints was immobilized by a cast. Learn more about temporary 100% disability benefits You’ll need to submit or identify these types of evidence: You’ll need to submit or identify these types of evidence: Medical records that show the diagnosis and severity of your claimed condition,and and Military records that show you meet the service requirements for the presumption If you have qualifying military service for a presumptive condition, you don’t need to prove that your service caused the condition. We automatically assume (or “presume”) that your service caused your condition. Learn more about presumptive conditions based on exposure to toxic materials: Burn pits during Gulf War service Agent Orange during Vietnam Era service Mustard gas or lewisite Contaminated water at Camp Lejeune Ionizing radiation Learn more about different types of presumptive conditions: Certain conditions for former prisoners of war Certain illnesses linked to Gulf War service in Afghanistan Certain illnesses linked to Gulf War service in Southwest Asia Certain other illnesses diagnosed within a year after discharge You’ll need to submit evidence that shows at least one of these led directly to an added disability or to your injury or disease getting worse: You’ll need to submit evidence that shows at least one of these led directly to an added disability or to your injury or disease getting worse: VA carelessness or negligence,or or VA medical or surgical treatment,or or A VA health exam,or or A VA vocational rehabilitation course (under 38 U.S.C. Chapter 31),or or VA compensated work therapy (CWT)(under 38 U.S.C. 1718) Learn more about VA Title 38 U.S.C. 1151 claims You’ll need to submit medical evidence that shows the child became permanently disabled because of a physical or mental disability before their 18th birthday. Additional evidence for certain benefits Find out what additional evidence you’ll need if you’re filing a claim for any of these benefits: You’ll need to submit evidence that shows at least one of these is true: You’ll need to submit evidence that shows at least one of these is true: You need another person to help you perform daily activities, like bathing, feeding, and dressing,or or You have to stay in bed—or spend a large portion of the day in bed—because of illness,or or You’re a patient in a nursing home due to the loss of mental or physical abilities related to a disability,or or You have limited eyesight (even with glasses or contact lenses you have only 5/200 or less in both eyes; or concentric contraction of the visual field to 5 degrees or less) For Housebound benefits, you’ll need to submit evidence that shows these descriptions are true: For Housebound benefits, you’ll need to submit evidence that shows these descriptions are true: You have a single service-connected disability rated at 100% disabling and another service-connected disability rated at 60% or more disabling,or or You spend most of your time in your home because of a permanent disability (a disability that doesn’t go away) You’ll also need to submit one of these forms: You’ll also need to submit one of these forms: An Examination for Housebound Status or Permanent Need for Regular Aid and Attendance (VA Form 21-2680)Get VA Form 21-2680 to downloador or If you’re in a nursing home, a Request for Nursing Home Information in Connection with Claim for Aid and Attendance (VA Form 21-0779)Get VA Form 21-0779 to download Learn more about Aid and Attendance benefits and Housebound allowance You’ll need to submit evidence that shows at least one of these descriptions is true: You’ll need to submit evidence that shows at least one of these descriptions is true: You have loss, or permanent loss of use, of one or both feet,or or You have loss, or permanent loss of use, of one or both hands,or or You have permanent decreased vision in both eyes: 20/200 vision or less in your better eye with glasses, or greater than 20/200 vision but with a visual field defect that has reduced your peripheral vision to 20 degrees or less in your better eye,or or You have a severe burn injury,or or You have amyotrophic lateral sclerosis (ALS),or or You have ankylosis in one or both knees or hips (Note:This qualifies you for an adaptive-equipment grant only) Note: You’ll also need to submit:An Application for Automobile or Other Conveyance and Adaptive Equipment (VA Form 21-4502)Get VA Form 21-4502 to download You’ll also need to submit: Learn more about automobile allowance and adaptive equipment You’ll need to submit both of these: You’ll need to submit both of these: Evidence that shows you’re a Veteran or service member with a qualifying permanent and totally disabling service-connected disabilityFind out if you have a qualifying service-connected disabilityand and An Application in Acquiring Specially Adapted Housing or Special Home Adaptation Grant (VA Form 26-4555)Get VA Form 26-4555 to download Learn more about disability housing grants",54,What type of evidence is needed to support a disability claim?,"To support a disability claim, you will need to submit evidence of a current physical or mental disability from a medical professional, evidence of an event, injury, or disease that happened during your active-duty service, and evidence of a link between your current disability and the event, injury, or disease that happened during your service. This usually requires medical records or medical opinions from health care providers to support the link. In certain situations, the link between your military service and your disability may be concluded even without evidence, such as with certain chronic illnesses appearing within a year after discharge or illnesses caused by contact with contaminants."
55,https://www.va.gov/disability/how-to-file-claim/,How to file a VA disability claim. disability how to file claim,Find out how to file a claim for disability compensation or increased disability compensation.,55,What is the process for filing a VA disability claim or for increasing disability compensation?,"To file a VA disability claim, individuals must first gather all necessary supporting documentation, such as medical records and service treatment records. They can then submit a claim online through the VA's eBenefits portal, by mail, or in person at a regional VA office. The VA will review the claim and supporting evidence to determine eligibility for disability compensation or an increase in compensation. It is important for individuals to provide as much information and evidence as possible to support their claim for the best chance of approval."
56,https://www.va.gov/disability/how-to-file-claim/,How do I prepare before starting my application?. disability how to file claim,"Find out if you’re eligible for VA disability compensation.Learn about eligibility Be sure to fill out your claim completely. Gather any evidence (supporting documents) you’ll submit yourself when you file your VA disability claim. We encourage you to send in all your supporting documents along with your claim. This will help us process your claim quickly.Learn about fully developed claims Find out if you’ll need to turn in any additional forms with your claim.Learn about additional forms you may need to file To learn more about filing a disability claim, you can play our disability claims video. Go to our disability claims video on YouTube",56,What steps should you take to prepare before starting your application for VA disability compensation?,"Before starting your application for VA disability compensation, you should first find out if you are eligible for it. You should also make sure to fill out your claim completely and gather any evidence or supporting documents that you will need to submit along with your claim. It is encouraged to send in all your supporting documents with your claim to help speed up the processing time. Additionally, you should learn about fully developed claims and find out if there are any additional forms you need to submit with your claim."
57,https://www.va.gov/disability/how-to-file-claim/,What evidence do I need to support my claim?. disability how to file claim,"You can support your VA disability claim by providing these documents: VA medical records and hospital records.These could relate to your claimed illnesses or injuries or they could show that your rated disability has gotten worse. VA medical records and hospital records. Private medical records and hospital reports.These could relate to your claimed illnesses or injuries or they could show that your disability has gotten worse. Private medical records and hospital reports. Supporting statements.These could be from family members, friends, clergy members, law enforcement personnel, or people you served with. These statements could tell us more about your claimed condition and how and when it happened or how it got worse. Supporting statements. Depending on the type of claim you file, you may gather supporting documents yourself, or you can ask for our help to gather evidence. Learn more about the evidence we’ll need for your claim We’ll also review your discharge papers (DD214 or other separation documents) and service treatment records. No. You don’t have to submit any evidence to support your claim. But we may need to schedule a claim exam so we can learn more about your condition. Learn more about VA claim exams (C&P exams) You should also know that you have up to a year from the date we receive your claim to turn in any evidence. If you start your application and need time to gather more supporting documents, you can save your application and come back later to finish it. We’ll recognize the date you started your application as your date of claim as long as you complete it within 365 days. You can file a claim in any of these 5 ways. Option 1: Online You can file a claim online now. File for disability compensation online Option 2: By mail File your claim by mail using an Application for Disability Compensation and Related Compensation Benefits (VA Form 21-526EZ).Get VA Form 21-526EZ to download Print the form, fill it out, and send it to this address: Department of Veterans AffairsClaims Intake CenterPO Box 4444Janesville, WI 53547-4444 Option 3: In person Bring your application to a VA regional office near you. Find a VA regional office near you Option 4: By fax If you’re in the U.S., fax your application to844-531-7818. If you’re outside the U.S., fax your application to248-524-4260. Option 5: With the help of a trained professional You can work with an accredited attorney, claims agent, or Veterans Service Organization (VSO) representative to get help filing a claim for disability compensation. Get help filing a claim If you plan to file for disability compensation using a paper form, you may want to submit an intent to file form first. This can give you the time you need to gather your evidence while avoiding a later potential start date (also called an effective date). When you notify us of your intent to file, you may be able to get retroactive payments (compensation that starts at a point in the past). Note:If you file for disability compensation online, then you don’t need to notify us of your intent to file. This is because your effective date gets set automatically when you start filling out the form online—before you submit it. Note: Find out how to submit an intent to file form Find out what happens after you file You don’t need to do anything while you’re waiting unless we send you a letter asking for more information. If we schedule exams for you, be sure not to miss them. Check your VA claim status How long does it take VA to make a decision? 147.2 days Average number of days to complete disability-related claims in May 2024 Average number of days to complete disability-related claims in May 2024",57,"not enough values to unpack (expected 2, got 1)",N/A
58,https://www.va.gov/disability/upload-supporting-evidence/,Upload evidence to support your disability claim. disability upload supporting evidence,"If you’ve filed a claim for disability compensation, you can continue uploading more evidence for up to one year to support your claim. Evidence may include supporting documents like medical test results, doctor’s reports, and other records. Upload your evidence online now.",58,What type of evidence can be uploaded to support a disability claim?,"Evidence that can be uploaded to support a disability claim includes supporting documents such as medical test results, doctor's reports, and other records. This evidence can be uploaded online for up to one year after filing a claim for disability compensation."
59,https://www.va.gov/disability/upload-supporting-evidence/,How do I upload evidence online to support my disability claim?. disability upload supporting evidence,"If you’re waiting for a decision on your disability claim, you can upload evidence to support that claim using our claim status tool. Upload evidence using our claim status tool Note:For any other type of document you’d like to submit online to us, please use the QuickSubmit tool through AccessVA. Note: Upload other types of documents through AccessVA",59,How can I upload evidence online to support my disability claim?,"You can upload evidence to support your disability claim using the claim status tool provided. It is recommended to use this tool specifically for uploading evidence related to your disability claim. However, for submitting any other type of document online, you should use the QuickSubmit tool through AccessVA. This tool is specifically designed for uploading other types of documents that are not related to your disability claim."
60,https://www.va.gov/disability/upload-supporting-evidence/,"If I filed a standard disability claim, when should I upload evidence?. disability upload supporting evidence","Upload your evidence as soon as you can. You can continue uploading documents for up to 1 year from the date we receive your claim. But, if you don’t provide any evidence or give us the information we need to help you get evidence within 30 days, we may make a decision on your claim earlier. If we decide your claim early, you’ll still have the rest of the 1-year period to provide more information or evidence.",60,When should evidence be uploaded for a standard disability claim?,"Evidence for a standard disability claim should be uploaded as soon as possible. While you have up to 1 year from the date the claim is received to continue uploading documents, it is important to provide evidence promptly. Failure to provide evidence or necessary information within 30 days may result in an early decision on the claim. However, even if a decision is made early, there is still the opportunity to provide additional information or evidence within the 1-year period."
61,https://www.va.gov/disability/upload-supporting-evidence/,What happens if I upload more evidence after I’ve submitted a fully developed claim?. disability upload supporting evidence,"We’ll remove your disability claim from the Fully Developed Claims program and process it as a standard claim. If we decide your claim earlier than 1 year from the date we received the claim, you’ll still have the rest of the year to provide any additional information or evidence.",61,What happens to a disability claim in the Fully Developed Claims program if additional evidence is uploaded after the claim has been submitted?,"If additional evidence is uploaded after a disability claim has been submitted in the Fully Developed Claims program, the claim will be removed from the program and processed as a standard claim. However, if the claim is decided earlier than 1 year from the date it was received, the claimant will still have the remainder of the year to provide any further information or evidence."
