,source_url,title,content,index,question,answer
22,https://www.va.gov/disability/dependency-indemnity-compensation/,Am I eligible for VA DIC as a surviving spouse or dependent?. disability dependency indemnity compensation,"As a surviving spouse Eligibility You may be eligible for VA benefits or compensation if you meet these requirements. One of these must be true: One of these must be true: You lived with the Veteran or service member without a break until their death,or or If you’re separated, you weren’t at fault for the separation And one of these must be true: And one of these must be true: You married the Veteran or service member within 15 years of their discharge from the period of military service during which the qualifying illness or injury started or got worse,or or You were married to the Veteran or service member for at least 1 year,or or You had a child with the Veteran or service member Note:If you remarried, you can receive or continue to receive compensation if one of these describes you: Note: You remarried on or after December 16, 2003, and you were 57 years of age or older at the time you remarried,or or You remarried on or after January 5, 2021, and you were 55 years of age or older at the time you remarried Evidence You’ll need to provide evidence with your claim showing that one of these descriptions is true for the Veteran or service member. Evidence may include documents like military service records, doctor’s reports, and medical test results. Provide evidence showing that one of these is true: Provide evidence showing that one of these is true: The service member died while on active duty, active duty for training, or inactive-duty training,or or The Veteran died from a service-connected illness or injury,or or The Veteran didn’t die from a service-connected illness or injury, but was eligible to receive VA compensation for a service-connected disability rated as totally disabling for a certain period of time If the Veteran’s eligibility was due to a rating of totally disabling, they must have had this rating: If the Veteran’s eligibility was due to a rating of totally disabling, they must have had this rating: For at least 10 years before their death,or or Since their release from active duty and for at least 5 years immediately before their death,or or For at least 1 year before their death if they were a former prisoner of war who died after September 30, 1999 Note:“Totally disabling” means the Veteran’s injuries made it impossible for them to work. Note: Learn more about the evidence you’ll need to support your claim As a surviving child Eligibility You may be eligible for VA benefits or compensation if you meet these requirements. All of these must be true: All of these must be true: You aren’t married,and and You aren’t included on the surviving spouse’s compensation,and and You’re under the age of 18 (or under the age of 23 if attending school) Note:If you were adopted out of the Veteran’s or service member’s family, but meet all other eligibility criteria, you still qualify for compensation. Note: Evidence You’ll need to provide evidence with your claim showing that one of these descriptions is true for the Veteran or service member. Evidence may include documents like military service records, doctor’s reports, and medical test results. Provide evidence showing that one of these is true: Provide evidence showing that one of these is true: The service member died while on active duty, active duty for training, or inactive-duty training,or or The Veteran died from a service-connected illness or injury,or or The Veteran didn’t die from a service-connected illness or injury, but was eligible to receive VA compensation for a service-connected disability that was rated as totally disabling for a certain period of time If the Veteran’s eligibility was due to a service-connected disability rated as totally disabling, they must have had this rating: If the Veteran’s eligibility was due to a service-connected disability rated as totally disabling, they must have had this rating: For at least 10 years before their death,or or Since their release from active duty and for at least 5 years immediately before their death,or or For at least 1 year before their death if they were a former prisoner of war who died after September 30, 1999 Note:“Totally disabling” means the Veteran’s injuries make it impossible for them to work. Note: Learn more about the evidence you’ll need to support your claim As a surviving parent Eligibility You may be eligible for VA benefits or compensation if you meet these requirements. Both of these must be true: Both of these must be true: You’re the biological, adoptive, or foster parent of the Veteran or service member,and and Your income is below a certain amountCheck the parents DIC rate table Note:We define a foster parent as someone who served in the role of a parent to the Veteran or service member before their last entry into active service. Note: Evidence You’ll need to provide evidence with your claim showing that one of these descriptions is true for the Veteran or service member. Evidence may include documents like military service records, doctor’s reports, and medical test results. Provide evidence showing that one of these is true: Provide evidence showing that one of these is true: The service member died from an injury or illness while on active duty or in the line of duty while on active duty for training,or The service member died from an injury or illness while on active duty or in the line of duty while on active duty for training,or or The service member died from an injury or certain illnesses in the line of duty while on inactive training,or The service member died from an injury or certain illnesses in the line of duty while on inactive training,or or The Veteran died from a service-connected illness or injury The Veteran died from a service-connected illness or injury Learn more about the evidence you’ll need to support your claim Note:If you’re the survivor of a Veteran who died from COVID-19 and a service-related condition made their illness worse, you may be eligible for VA DIC. When we review your application, we’ll consider whether a service-related condition contributed to your loved one’s illness. Note:",22,What are the eligibility requirements for VA DIC as a surviving spouse or dependent?,"The eligibility requirements for VA Dependency and Indemnity Compensation (DIC) as a surviving spouse include living with the Veteran without a break until their death or not being at fault for the separation, marrying the Veteran within a certain timeframe or having a child with the Veteran, and providing evidence of the Veteran's death being service-connected or due to a totally disabling disability. For a surviving child to be eligible, they must be unmarried, under a certain age, and provide evidence of the Veteran's death being service-connected or due to a totally disabling disability. For a surviving parent to be eligible, they must be the biological, adoptive, or foster parent of the"
23,https://www.va.gov/disability/dependency-indemnity-compensation/,What kind of benefits can I get?. disability dependency indemnity compensation,"If you qualify, you can get tax-free monetary benefits. The amount you receive depends on the type of survivor you are. DIC benefit rates for surviving spouses and children DIC benefits for surviving parents",23,What type of benefits can you receive if you qualify and what determines the amount of benefits you receive?,"If you qualify, you can receive tax-free monetary benefits through the Disability Dependency Indemnity Compensation (DIC) program. The amount of benefits you receive depends on the type of survivor you are, such as surviving spouses, children, or parents. DIC benefit rates vary for each category of survivors, with different criteria and amounts set by the program."
24,https://www.va.gov/disability/dependency-indemnity-compensation/,How do I apply for compensation?. disability dependency indemnity compensation,"First you’ll need to fill out an application for benefits. The application you fill out will depend on your survivor status. If you’re the surviving spouse or child of a service member who died while on active duty,your military casualty assistance officer will help you to complete an Application for DIC, Death Pension, and/or Accrued Benefits by a Surviving Spouse or Child (VA Form 21P-534a). The officer will help you mail the form to the correct VA regional office. If you’re the surviving spouse or child of a service member who died while on active duty, Get VA Form 21P-534a to download If you’re the surviving spouse or child of a Veteran,fill out an Application for DIC, Death Pension, and/or Accrued Benefits (VA Form 21P-534EZ). If you’re the surviving spouse or child of a Veteran, Get VA Form 21P-534EZ to download If you’re a surviving parent,fill out an Application for Dependency and Indemnity Compensation by Parent(s) (VA Form 21P-535). If you’re a surviving parent, Get VA Form 21P-535 to download You can apply for this benefit in any of these ways: Work with an accredited attorney, claims agent, or Veterans Service Organization (VSO) representative.Get help filing a claim Use the QuickSubmit tool through AccessVA to upload your form online.Go to AccessVA to use QuickSubmit Mail your form to this address:Department of Veterans AffairsPension Intake CenterPO Box 5365Janesville, WI 53547-5365 Mail your form to this address: Department of Veterans AffairsPension Intake CenterPO Box 5365Janesville, WI 53547-5365 Go to a VA regional office and get help from a VA employee.Find a VA regional office near you",24,"not enough values to unpack (expected 2, got 1)",N/A
25,https://www.va.gov/disability/dependency-indemnity-compensation/,Should I submit an intent to file form?. disability dependency indemnity compensation,"You may want to submit an intent to file form before you apply for DIC benefits. This can give you the time you need to gather your evidence while avoiding a later potential start date (also called an effective date). When you notify us of your intent to file, you may be able to get retroactive payments (payments that start at a point in the past). Find out how to submit an intent to file form",25,Why should I consider submitting an intent to file form before applying for DIC benefits?,"Submitting an intent to file form before applying for DIC benefits can give you the time needed to gather evidence while avoiding a later potential start date. By notifying the relevant authorities of your intent to file, you may be eligible for retroactive payments that start at a point in the past. This can ultimately help ensure that you receive the maximum benefits available to you."
26,https://www.va.gov/disability/eligibility/hazardous-materials-exposure/,Exposure to hazardous chemicals and materials. disability eligibility hazardous materials exposure,Learn about chemical hazards or other hazardous materials you may have come in contact with during military service. And find out if you can get VA disability compensation for illnesses or conditions related to these exposures. We call these presumptive conditions.,26,"What can veterans do to learn about potential exposure to hazardous chemicals or materials during their military service, and is there a possibility of receiving VA disability compensation for related illnesses or conditions?","Veterans can find out about potential exposure to hazardous chemicals or materials during their military service by learning about chemical hazards or other hazardous materials they may have come in contact with. If veterans have illnesses or conditions related to these exposures, they may be eligible to receive VA disability compensation for presumptive conditions. VA disability compensation is available for illnesses or conditions that are presumed to be related to military service, including those caused by exposure to hazardous materials."
27,https://www.va.gov/disability/eligibility/hazardous-materials-exposure/,Agent Orange. disability eligibility hazardous materials exposure,"Agent Orange If you served in the Republic of Vietnam or in or near the Korean Demilitarized Zone (DMZ) during the Vietnam Era—or in certain related jobs—you may have had contact with Agent Orange, an herbicide used to clear plants and trees during the war. Learn about compensation based on Agent Orange exposure Asbestos If you worked in certain military jobs, you may have had contact with asbestos (toxic fibers once used in many buildings and products). Learn about compensation based on asbestos exposure Birth defects like spina bifida If you served in the Republic of Vietnam, in Thailand, or in or near the Korean DMZ during the Vietnam Era—and your child has spina bifida or certain other birth defects—your child may be eligible for disability benefits. Learn about compensation based on birth defects like spina bifida Burn pits and other specific environmental hazards If you served in Iraq, Afghanistan, or certain other areas, you may have had contact with toxic chemicals in the air, water, or soil. Learn about compensation based on burn pits and other specific environmental hazards Contact with mustard gas or lewisite If you served at the German bombing of Bari, Italy, in World War II or worked in certain other jobs, you may have had contact with mustard gas. Learn about compensation based on mustard gas or lewisite exposure Contaminated drinking water at Camp Lejeune If you served at Camp Lejeune or MCAS New River between August 1953 and December 1987, you may be at risk of certain illnesses believed to be caused by contaminants found in the drinking water during that time. Learn about compensation based on contaminated drinking water at Camp Lejeune Gulf War Illnesses in Southwest Asia If you served in the Southwest Asia theater of operations, you may be at risk of certain illnesses or other conditions linked to this region. Learn about compensation based on Gulf War illnesses in Southwest Asia Gulf War Illnesses in Afghanistan If you served in Afghanistan, you may be at risk of certain illnesses or other conditions linked to this region. Learn about compensation based on Gulf War illnesses in Afghanistan Project 112 or Project SHAD If you were part of warfare testing for Project 112 or Project Shipboard Hazard and Defense (SHAD) from 1962 to 1974, you may be at risk of illnesses believed to be caused by chemical testing. Learn about compensation based on Project 112/SHAD Radiation exposure If you served in the post-WWII occupation of Hiroshima or Nagasaki, were imprisoned in Japan, worked with or near nuclear weapons testing, or served at a gaseous diffusion plant or in certain other jobs, you may be at risk of illnesses believed to be caused by radiation. Learn about compensation based on radiation exposure",27,What types of hazardous materials exposure could result in disability eligibility for military personnel?,"Military personnel may be eligible for disability benefits if they were exposed to hazardous materials such as Agent Orange, asbestos, burn pits and other specific environmental hazards, mustard gas, contaminated drinking water at Camp Lejeune, Gulf War illnesses in Southwest Asia and Afghanistan, Project 112 or Project SHAD warfare testing, and radiation exposure. These exposures could result in various illnesses or conditions that may qualify for compensation."
28,https://www.va.gov/disability/eligibility/illnesses-within-one-year-of-discharge/,Disabilities that appear within 1 year after discharge. disability eligibility illnesses within one year of discharge,"If you have certain chronic (long-lasting) conditions that started within 1 year after your discharge from active military service, you may be eligible for VA disability compensation. Eligible conditions include high blood pressure (hypertension), arthritis, diabetes, or peptic ulcers. Compensation provides tax-free monthly payments. Keep reading to find out if you may be eligible.",28,What chronic conditions that start within one year of discharge from active military service make a person eligible for VA disability compensation?,"Chronic conditions such as high blood pressure (hypertension), arthritis, diabetes, and peptic ulcers that start within one year after discharge from active military service can make a person eligible for VA disability compensation. This compensation offers tax-free monthly payments to individuals who qualify based on their medical conditions. If you believe you may have one of these conditions that appeared within the specified timeframe, it is recommended to further investigate your eligibility for VA disability compensation."
29,https://www.va.gov/disability/eligibility/illnesses-within-one-year-of-discharge/,How do I file a claim for compensation?. disability eligibility illnesses within one year of discharge,"You can file a claim online now. You can also file by mail, in person, or with the help of a trained professional. File for disability compensation online Learn about other ways to file a disability compensation claim",29,How can I file a claim for compensation for disability eligibility illnesses within one year of discharge?,"You can file a claim for compensation for disability eligibility illnesses within one year of discharge in several ways. You have the option to file online, by mail, in person, or with the assistance of a trained professional. Filing online allows for a convenient and efficient process, while other options provide more personalized support. It is important to explore all available filing methods to determine the best approach for your specific situation."
30,https://www.va.gov/disability/eligibility/illnesses-within-one-year-of-discharge/,What evidence will I need to provide to support my claim?. disability eligibility illnesses within one year of discharge,"Here’s what you’ll need to provide: Evidence that your condition is at least 10% disabling (like a doctor’s report that shows you take medicine for your high blood pressure),and and Evidence that your condition appeared within 1 year after your discharge from active service (like a medical report with the date of your diagnosis) Note:If you have a condition listed in Title 38, Code of Federal Regulation, 3.309(a), you won’t need to show the problem started during—or got worse because of—your military service. This is because we automatically assume (or “presume”) that certain conditions that appear within 1 year after discharge are caused by your service. We call these presumptive conditions. Note: Download Title 38, Code of Federal Regulation, 3.309(a) for a complete list of covered illnesses (DOC)",30,"not enough values to unpack (expected 2, got 1)",N/A
31,https://www.va.gov/disability/eligibility/illnesses-within-one-year-of-discharge/,Are any illnesses covered if they appear more than 1 year after discharge?. disability eligibility illnesses within one year of discharge,"Yes. You may be eligible for disability compensation for these illnesses, even if they appear more than 1 year after discharge: Hansen’s disease(a long-lasting infection that affects your skin, nerves, and mucous membranes) can appear within 3 years after discharge. Hansen’s disease Tuberculosis(an infection that attacks your lungs and sometimes other areas of your body) can appear within 3 years after discharge. Tuberculosis Multiple sclerosis(a long-lasting illness that can cause numbness, weakness, and many other symptoms) can appear within 7 years after discharge. Multiple sclerosis Amyotrophic lateral sclerosis (ALS), also known as Lou Gehrig’s disease (a long-lasting illness that affects muscle control), can appear any time after discharge. Amyotrophic lateral sclerosis (ALS)",31,What illnesses are covered for disability compensation even if they appear more than 1 year after discharge?,"You may be eligible for disability compensation for illnesses such as Hansen’s disease, Tuberculosis, Multiple sclerosis, and Amyotrophic lateral sclerosis (ALS) even if they appear more than 1 year after discharge. Hansen’s disease can appear within 3 years after discharge, Tuberculosis can appear within 3 years after discharge, Multiple sclerosis can appear within 7 years after discharge, and ALS can appear any time after discharge."
32,https://www.va.gov/disability/eligibility/ptsd/,Disability compensation for PTSD. disability eligibility ptsd,"If you have posttraumatic stress from a traumatic event you experienced during your service, you may be eligible for VA disability compensation for posttraumatic stress disorder (PTSD). Compensation provides tax-free monthly payments. Keep reading to find out if you may be eligible. Learn more about PTSD",32,What type of compensation may be available for individuals with posttraumatic stress disorder (PTSD) resulting from a traumatic event during their service?,"Veterans who have posttraumatic stress disorder (PTSD) stemming from a traumatic event during their service may be eligible for VA disability compensation. This compensation provides tax-free monthly payments to eligible individuals. To determine eligibility for this compensation, individuals should continue reading to learn more about the specific criteria and requirements."
33,https://www.va.gov/disability/eligibility/ptsd/,What does VA consider to be a traumatic event?. disability eligibility ptsd,"We consider any of these to be a traumatic event: You suffered a serious injury, personal or sexual trauma, or sexual violation,or or Someone or something threatened you with injury, sexual assault, or death",33,What does the VA consider to be a traumatic event for disability eligibility related to PTSD?,"The VA considers a traumatic event to be any situation where an individual suffered a serious injury, personal or sexual trauma, sexual violation, or where someone or something threatened them with injury, sexual assault, or death. These types of events can lead to the development of PTSD, which is a qualifying condition for disability benefits from the VA. In order to be eligible for disability benefits related to PTSD, a traumatic event meeting these criteria must have occurred."
34,https://www.va.gov/disability/eligibility/ptsd/,How do I file a claim for compensation?. disability eligibility ptsd,"You can file a claim online now. You can also file by mail, in person, or with the help of a trained professional. File for disability compensation online Learn about other ways to file a disability compensation claim Note:In our screening process, we’ll focus on understanding your PTSD to help determine your eligibility for disability benefits. We won’t offer you treatment during this process. Note: Additional forms you’ll need to submit When you file a disability compensation claim, you’ll also need to fill out one of these additional forms: A Statement in Support of Claim for Service Connection for PTSD (VA Form 21-0781).Get VA Form 21-0781 to downloador or A Statement in Support of Claim for Service Connection for PTSD Secondary to Personal Assault (VA Form 21-0781a).Get VA Form 21-0781a to download",34,"not enough values to unpack (expected 2, got 1)",N/A
35,https://www.va.gov/disability/eligibility/special-claims/,Special claims. disability eligibility special claims,Find out if you can get special compensation for service-connected disabilities like the ones listed here. A service-connected disability is an illness or injury caused or made worse by your active-duty service.,35,What type of compensation can you potentially receive for service-connected disabilities mentioned in the paragraph?,You can potentially receive special compensation for service-connected disabilities such as illness or injury caused or made worse by your active-duty service. This special compensation is for disabilities that are directly related to your military service and may include additional benefits or financial assistance. It is important to determine if your disability meets the eligibility criteria for special claims in order to receive the compensation you are entitled to.
