,source_url,title,content,index,question,answer
0,https://www.va.gov/disability/after-you-file-claim/,The VA claim process after you file your claim. disability after you file claim,Learn about what happens after you file your claim. And find out the average number of days it takes to process a VA disability claim.,0,What is the average number of days it takes to process a VA disability claim after it has been filed?,"The average number of days it takes to process a VA disability claim after it has been filed can vary depending on various factors, but as of the latest data available, it typically takes around 120 days. During this time, the VA will gather any necessary evidence, such as medical records and other documentation, to make a decision on the claim. It is important to stay informed about the status of your claim and to provide any additional information requested by the VA in a timely manner to help expedite the process."
1,https://www.va.gov/disability/after-you-file-claim/,How long does it take VA to make a decision?. disability after you file claim,147.2 days Average number of days to complete disability-related claims in May 2024 Average number of days to complete disability-related claims in May 2024,1,What is the average number of days it takes for VA to complete disability-related claims in May 2024?,"The average number of days it takes for the VA to complete disability-related claims in May 2024 is 147.2 days. This means that, on average, it takes approximately 147.2 days for the VA to make a decision on a disability-related claim after it has been filed. This information provides insight into the timeline and process involved in receiving a decision on disability claims from the VA."
2,https://www.va.gov/disability/after-you-file-claim/,The time it takes to review your claim depends on these factors:. disability after you file claim,The time it takes to review your claim depends on these factors: The time it takes to review your claim depends on these factors: The type of claim you filed How many injuries or disabilities you claimed and how complex they are How long it takes us to collect the evidence we need to decide your claim,2,What factors affect the time it takes to review a claim for disability after it has been filed?,"The time it takes to review a claim for disability after it has been filed depends on several factors. These factors include the type of claim that was filed, the number of injuries or disabilities claimed, and how complex they are. Additionally, the time it takes to collect the necessary evidence to make a decision on the claim can also impact the review process. Ultimately, all these factors play a role in determining the length of time it will take for a claim to be reviewed."
3,https://www.va.gov/disability/after-you-file-claim/,What should I do while I wait?. disability after you file claim,"You don’t need to do anything unless we send you a letter asking for more information. If we schedule any exams for you, be sure not to miss them. You can check the status of your claim online. The timeline listed there may vary based on how complex your claim is. Check your VA claim status",3,What should you do while waiting for a disability claim after filing?,"While waiting for a disability claim after filing, you do not need to do anything unless the VA sends you a letter requesting more information. It is important to not miss any scheduled exams, if any are required for your claim. Additionally, you can check the status of your claim online to see where it is in the process. The timeline for processing your claim may vary depending on the complexity of your specific case."
4,https://www.va.gov/disability/after-you-file-claim/,What happens after I file a VA disability claim?. disability after you file claim,"Claim received We’ll let you know when we receive your VA disability claim. If you file your claim online,you’ll get an on-screen message from us after you submit the form. If you file your claim online, If you mail your application,we’ll send you a letter to let you know we have your claim. You should get this letter about 1 week, plus mailing time, after we receive your claim. If you mail your application, Initial review We’ll review your claim. Evidence gathering, review, and decision During this step, we’ll do 3 things: Ask for evidence from you, health care providers, government agencies, or others Review the evidence Make a decision If we need more evidence during the review, your claim may return to this step more than once. Preparation for notification We’ll get your claim decision packet ready to mail. Claim complete We’ll send you a packet by U.S. mail that includes details of the decision on your claim. Please allow 7 to 10 business days for your packet to arrive before contacting a VA call center.",4,What are the steps involved in the process after filing a VA disability claim?,"After filing a VA disability claim, the first step is the receipt of the claim, where you will be informed that your claim has been received. The next step involves an initial review of your claim. Following that, evidence gathering, review, and a decision will take place. If more evidence is needed, the claim may return to the evidence gathering step. After the decision is made, the preparation for notification will occur, and finally, you will receive a packet by U.S. mail detailing the decision on your claim."
5,https://www.va.gov/disability/after-you-file-claim/,What should I do if I disagree with my VA disability claim decision?. disability after you file claim,"If you disagree with a claim decision that you receivedon or after February 19, 2019,you can ask us to review the decision. You have 3 decision review options to choose from. on or after February 19, 2019, Learn about your decision review options",5,"What are the options available to you if you disagree with your VA disability claim decision after February 19, 2019?","If you disagree with a claim decision that you received on or after February 19, 2019, you have three decision review options to choose from. These options include a Higher-Level Review, Supplemental Claim, or Appeal to the Board of Veterans' Appeals. Each option has its own process and requirements, so it's important to understand the details of each before making a decision on how to proceed. It's recommended to consult with a Veterans Service Officer or legal representative to help guide you through the decision review process."
6,https://www.va.gov/change-address/,Change your address in your VA.gov profile. change address,Find out how to change your address and other contact information in your VA.gov profile. This will update your information across several VA benefits and services.,6,How can you update your address and other contact information in your VA.gov profile and what benefits and services will this update affect?,"To change your address and other contact information in your VA.gov profile, you can follow the instructions provided on the website. By updating this information, it will be reflected across multiple VA benefits and services, ensuring that you receive important communications and updates accurately. This process helps to ensure that your information is up to date and that you continue to receive the necessary support and services from the VA."
7,https://www.va.gov/change-address/,What’s the advantage of using my VA.gov profile to change my address?. change address,"When you change the address and other contact information in your VA.gov profile, it updates across these VA benefits and services: VA health care (including prescriptions, appointment reminders, lab and test results, and communications from your VA medical center) Disability compensation Pension benefits Claims and appeals Veteran Readiness and Employment (VR&E)",7,What benefits and services are updated when changing your address through your VA.gov profile?,"When changing your address through your VA.gov profile, it updates across various VA benefits and services, including VA health care (such as prescriptions, appointment reminders, lab and test results, and communications from your VA medical center), disability compensation, pension benefits, claims and appeals, and Veteran Readiness and Employment (VR&E). This ensures that all relevant information is accurately reflected in these services and benefits."
8,https://www.va.gov/change-address/,How do I change my address in my VA.gov profile?. change address,"You can change your mailing and home addresses in your profile’scontact informationsection. To do this, you need to be signed in to VA.gov with a verified account. contact information",8,How can I change my address in my VA.gov profile?,"To change your address in your VA.gov profile, you can do so by accessing the contact information section. This can be done by signing in to VA.gov with a verified account. Once logged in, you will be able to update both your mailing and home addresses as needed. It is important to ensure that your address is up to date to receive important information and benefits from the VA."
9,https://www.va.gov/change-address/,Will this update my address for all VA benefits and services?. change address,"No, not at this time. Some of our departments keep your contact information in their own separate records. If you use any of the VA benefits or services listed below, you’ll need to contact the department that handles those benefits directly to change your information. Contact the department directly for these VA benefits and services Education benefits Home loan benefits Life insurance benefits CHAMPVA The Foreign Medical Program Find the contact information you need",9,For which VA benefits and services do you need to contact the department directly to change your address?,"You need to contact the department directly for the following VA benefits and services: Education benefits, Home loan benefits, Life insurance benefits, CHAMPVA, The Foreign Medical Program. These departments keep your contact information in their own separate records, so updating your address for all VA benefits and services is not done automatically."
10,https://www.va.gov/change-direct-deposit/,Change your direct deposit information. change direct deposit,Learn how to change your direct deposit information for your VA benefit payments.,10,How can you change your direct deposit information for your VA benefit payments?,"To change your direct deposit information for your VA benefit payments, you can do so by visiting the official website of the Department of Veterans Affairs and logging into your account. From there, you can navigate to the direct deposit section where you can update your banking information. Alternatively, you can also contact the VA directly via phone or in-person to request the change in your direct deposit information. It is important to ensure that the new banking information provided is accurate to avoid any delays or issues with receiving your benefit payments."
11,https://www.va.gov/change-direct-deposit/,. change direct deposit,You can update your direct deposit information for these 3 types of benefit payments in your VA.gov profile: Disability compensation payments Education benefit payments Pension payments You’ll need your bank account and routing number.,11,What are the 3 types of benefit payments for which you can update your direct deposit information in your VA.gov profile?,"The three types of benefit payments for which you can update your direct deposit information in your VA.gov profile are disability compensation payments, education benefit payments, and pension payments. To make these updates, you will need to have your bank account and routing number ready. This process allows for a more convenient and secure way to receive your benefits directly into your bank account."
12,https://www.va.gov/change-direct-deposit/,How to get help with changing your information in your profile. change direct deposit,How to get help with changing your information in your profile Get step-by-step instructions for changing your direct deposit information online Or you can call us at800-698-2411(TTY: 711). We’re here 24/7.,12,How can you get help with changing your direct deposit information in your profile?,"You can get help with changing your direct deposit information in your profile by either following step-by-step instructions online or by calling 800-698-2411 (TTY: 711). The instructions will guide you through the process of updating your direct deposit information, or you can speak with a representative over the phone for assistance. The support is available 24/7, ensuring you can get help whenever you need it."
13,https://www.va.gov/claim-or-appeal-status/,"Check your VA claim, decision review, or appeal status. claim or appeal status","Find out how to check the status of certain VA claims, decision reviews, or appeals online.",13,"How can I check the status of my VA claim, decision review, or appeal online?","You can check the status of your VA claim, decision review, or appeal online by visiting the official VA website and logging into your personal account. Once logged in, you can navigate to the specific section for claims, decision reviews, or appeals and view the current status of your case. This online tool provides real-time updates on the progress of your claim, review, or appeal, allowing you to stay informed throughout the process. Additionally, you may also receive notifications via email or mail regarding any changes to your case status."
14,https://www.va.gov/claim-or-appeal-status/,"What types of claims, decision reviews, and appeals can I check in this tool?. claim or appeal status","You can use this tool to check the status of a VA claim, decision review, or appeal for these types of benefits: You can use this tool to check the status of a VA claim, decision review, or appeal for these types of benefits: Disability compensation (including claims based on special needs like an automobile or clothing allowance) Veterans or Survivors Pension benefits Special monthly compensation (such as Aid and Attendance) Dependency and Indemnity Compensation (DIC) Burial allowance to help pay for a Veteran’s burial and funeral expenses Specially Adapted Housing (SAH) or Special Housing Adaptation (SHA) grant You can also use this tool to check the status of these types of requests: You can also use this tool to check the status of these types of requests: Requests to add or remove dependents Requests for approval of school attendance for dependent children",14,"What types of claims, decision reviews, and appeals can you check the status of using this tool?","You can use this tool to check the status of a VA claim, decision review, or appeal for various types of benefits including Disability compensation, Veterans or Survivors Pension benefits, Special monthly compensation, Dependency and Indemnity Compensation, Burial allowance, Specially Adapted Housing or Special Housing Adaptation grant. Additionally, you can check the status of requests to add or remove dependents and requests for approval of school attendance for dependent children."
15,https://www.va.gov/claim-or-appeal-status/,Can I use this tool?. claim or appeal status,"To use this tool, you’ll need to have one of these free accounts: To use this tool, you’ll need to have one of these free accounts: A verifiedLogin.govaccount,or Login.gov or A verifiedID.meaccount,or ID.me or A PremiumDS Logonaccount (used for eBenefits and milConnect),or DS Logon or A PremiumMy HealtheVetaccount My HealtheVet",15,What are the requirements for using the tool for claim or appeal status?,"To use the tool for claim or appeal status, you will need to have one of the following free accounts: a verified Login.gov account, a verified ID.me account, or a Premium DS Logon account (used for eBenefits and milConnect), or a Premium My HealtheVet account. These accounts are necessary to access the tool and check the status of your claim or appeal. Without one of these accounts, you will not be able to use the tool."
16,https://www.va.gov/claim-or-appeal-status/,"Once I’m signed in, how do I check my status?. claim or appeal status","You’ll find a list of your claims, decision reviews, and appeals. You can check the statuses in the list. Or you can select a claim, decision review, or appeal to review the full details.",16,"How can I check my claim, decision review, or appeal status once I am signed in?","Once you are signed in, you can check your claim, decision review, or appeal status by accessing a list that shows all of your claims, decision reviews, and appeals. This list allows you to view the statuses of each case. Additionally, you have the option to select a specific claim, decision review, or appeal from the list to review the full details and status updates. This way, you can easily monitor the progress and status of your claims, decision reviews, and appeals."
17,https://www.va.gov/claim-or-appeal-status/,What kind of information can I get from this tool?. claim or appeal status,"You can find out where your claim, decision review, or appeal is in our review process. You can also check these details: You can also check these details: Any evidence you’ve filed online to support your initial claim Any additional evidence we’ve requested from you Your claim, decision review, or appeal type What you’ve claimed You can also use the tool to upload and download some documents: You can also use the tool to upload and download some documents: Upload evidence for an initial claim (you can’t use this tool to upload evidence for a decision review or an appeal) Download decision letters for certain types of claims, decision reviews, and appeals",17,"not enough values to unpack (expected 2, got 1)",N/A
18,https://www.va.gov/claim-or-appeal-status/,What if I sent a document to VA as evidence and it’s not listed?. claim or appeal status,"This may be because certain documents won’t appear online. We won’t list these types of documents: We won’t list these types of documents: Documents you sent to us by mail or fax,or or Documents you brought to us in person,or or Documents we’ve restricted to protect your or someone else’s privacy",18,Why might a document sent to the VA as evidence not be listed in the claim or appeal status online?,"A document sent to the VA as evidence may not be listed in the claim or appeal status online because certain types of documents, such as those sent by mail, fax, brought in person, or restricted for privacy reasons, will not appear online. These documents are not listed on the VA's online platform for various reasons related to privacy and security."
19,https://www.va.gov/claim-or-appeal-status/,Will VA protect my personal information if I use this tool?. claim or appeal status,"Yes. This is a secure website. We follow strict security policies and practices to protect your personal health information. If you print or download anything from the website, you’ll need to take responsibility for protecting that information.",19,How does VA protect personal information when using the claim or appeal status tool?,"Yes, VA ensures the protection of personal information when using the claim or appeal status tool by operating on a secure website and adhering to strict security policies and practices. Additionally, individuals using the tool are advised to take responsibility for protecting any printed or downloaded information from the website."
20,https://www.va.gov/claim-or-appeal-status/,What if I have more questions?. claim or appeal status,"You can call us at800-827-1000(TTY: 711). We’re here Monday through Friday, 8:00 a.m. to 9:00 p.m. ET.",20,How can I inquire about claim or appeal status and what are the available contact hours for assistance?,"To inquire about claim or appeal status, you can contact us at 800-827-1000 (TTY: 711). Our customer service representatives are available to assist you Monday through Friday from 8:00 a.m. to 9:00 p.m. ET. You can reach out to us during these hours to get information about your claim or appeal."
21,https://www.va.gov/disability/dependency-indemnity-compensation/,"About VA DIC for spouses, dependents, and parents. disability dependency indemnity compensation","If you’re the surviving spouse, child, or parent of a service member who died in the line of duty, or the survivor of a Veteran who died from a service-related injury or illness, you may be able to get a tax-free monetary benefit called VA Dependency and Indemnity Compensation (VA DIC). Find out if you can get VA benefits or compensation.",21,What is VA DIC and who is eligible to receive it?,"VA DIC stands for Dependency and Indemnity Compensation and is a tax-free monetary benefit provided by the VA for surviving spouses, children, and parents of service members who died in the line of duty or veterans who died from a service-related injury or illness. Eligibility for VA DIC is based on the circumstances of the service member or veteran's death and the relationship to the deceased individual. It is important to determine if you qualify for VA benefits or compensation in order to receive this benefit."
