,source_url,title,content,index,question,answer
36,https://www.va.gov/disability/eligibility/special-claims/,Automobile allowance and adaptive equipment. disability eligibility special claims,"Automobile allowance and adaptive equipment If your service-connected disability prevents you from driving, find out if you can get money to help buy a specially equipped vehicle or make needed changes to your existing vehicle. Learn more about special claims to get an automobile allowance and adaptive equipment Birth defects linked to Agent Orange If you were exposed to specific chemicals while serving in Vietnam, Thailand, or the Korean Demilitarized Zone, and your child has spina bifida or other birth defects, your child may be eligible for certain benefits. Learn more about special claims for birth defects linked to Agent Orange Replacing damaged clothing If your clothing’s been damaged by your prosthetic or orthopedic device—or by medicine you’re taking for a skin condition—find out if you can get money to help buy new clothes. Learn more about special claims to replace damaged clothing Recovery from surgery or an immobilizing disability (convalescence) If you’re recovering from surgery or other treatment related to your service-connected disability that’s left you unable to move, find out if you can get temporary disability payments or other benefits. Learn more about special claims based on recovery from surgery or an immobilizing disability Dental care If you’re a Veteran, find out if you can get dental care through VA. Learn more about special claims for dental care Time spent in a hospital If you spent time in a VA or VA-approved hospital for a service-connected disability, find out if you can get benefits like disability payments for that time. Learn more about special claims for time spent in a hospital Being unable to work (Individual Unemployability) If you can’t work because of your service-connected disability, find out if you can get increased disability payments. Learn more about special claims based on Individual Unemployability Title 38 U.S.C. 1151 disabilities If you suffered an added disability while getting VA medical care or taking part in a VA program designed to help you find, get, or keep a job, find out if you can get disability payments. Learn more about special claims based on Title 38 U.S.C. 1151 disabilities Immediate help for temporary disability needs (prestabilization) If you recently ended your active military service and you have a service-connected disability, find out if you can get temporary disability payments or other benefits right away. Learn more about special claims to get immediate help for temporary disability needs",36,What types of special claims can Veterans apply for related to their service-connected disabilities?,"Veterans can apply for special claims related to automobile allowance and adaptive equipment, birth defects linked to Agent Orange, replacing damaged clothing, recovery from surgery or immobilizing disability, dental care, time spent in a hospital, being unable to work (Individual Unemployability), Title 38 U.S.C. 1151 disabilities, and immediate help for temporary disability needs. These claims can help provide financial assistance or benefits for various needs and situations related to the Veteran's service-connected disability."
37,https://www.va.gov/disability/eligibility/,Eligibility for VA disability benefits. disability eligibility,"VA disability compensation provides tax-free monthly payments. If you have a service-connected condition, you may be eligible for compensation. A service-connected condition means an illness or injury that was caused by—or got worse because of—your active military service. Keep reading to find out if you may be eligible.",37,What is the criteria for eligibility for VA disability benefits?,"To be eligible for VA disability benefits, you must have a service-connected condition, which means an illness or injury that was caused by or worsened because of your active military service. If you meet this criteria, you may be eligible for tax-free monthly payments through VA disability compensation. If you are unsure about your eligibility, it is recommended to keep reading or consult with a VA representative for more information."
38,https://www.va.gov/disability/eligibility/,"What should I do if I received an other than honorable, bad conduct, or dishonorable discharge?. disability eligibility","If you’ve received one of these discharge statuses, you may not be eligible for VA disability benefits. There are 2 ways you can try to qualify: There are 2 ways you can try to qualify: Find out how to apply for a discharge upgrade Learn about the VA Character of Discharge review process You can file a claim online now. You can also file by mail, in person, or with the help of a trained professional. File for disability compensation online now Learn about other ways to file a disability compensation claim You may be able to get VA disability benefits for conditions like these: You may be able to get VA disability benefits for conditions like these: Chronic (long-lasting) back pain resulting in a current diagnosed back disability Breathing problems resulting from a current lung condition or lung disease Severe hearing loss Scar tissue Loss of range of motion (problems moving your body) Ulcers Cancers or other conditions caused by contact with toxic chemicals or other dangers You may also be able to get VA disability benefits for conditions like these: You may also be able to get VA disability benefits for conditions like these: Anxiety Depression Mental or physical health conditions related to military sexual trauma (MST)Learn about MST and disability compensation Posttraumatic stress disorder (PTSD) Traumatic brain injury (TBI) Go to our Compensation 101 videos to learn more about how VA disability compensation works: Compensation 101: What is disability compensation? (YouTube) Compensation 101: What is service connection? (YouTube)",38,"not enough values to unpack (expected 2, got 1)",N/A
39,https://www.va.gov/disability/how-to-file-claim/additional-forms/,File additional forms for your disability claim. disability how to file claim additional forms,Find out if you’ll need to turn in any additional forms when you file your disability claim.,39,What should you do in order to file additional forms for your disability claim?,"To file additional forms for your disability claim, you will need to determine if any additional forms are required. This can typically be done by contacting the relevant disability office or visiting their website for more information. Once you have identified the additional forms needed, make sure to fill them out accurately and completely before submitting them along with your initial disability claim. It is important to follow all instructions provided to ensure your claim is processed efficiently."
40,https://www.va.gov/disability/how-to-file-claim/additional-forms/,. disability how to file claim additional forms,"’ (Individual Unemployability) When you file a claim for disability compensation, you’ll also need to submit both of these forms: When you file a claim for disability compensation, you’ll also need to submit both of these forms: A Veteran’s Application for Increased Compensation Based on Unemployability (VA Form 21-8940) Get VA Form 21-8940 to download and and A Request for Employment Information in Connection with Claim for Disability Benefits (VA Form 21-4192) Get VA Form 21-4192 to download Learn more about special claims based on Individual Unemployability If you’re filing a claim for disability compensation online,you don’t need to submit this PDF form.We’ll ask you questions about your claim for increased compensation based on Individual Unemployability when you fill out your online claim. If you’re filing a claim for disability compensation online,  When you file a claim for disability compensation, you’ll also need to submit this form: When you file a claim for disability compensation, you’ll also need to submit this form: A Statement in Support of Claim for Service Connection for Post-Traumatic Stress Disorder (VA Form 21-0781) Get VA Form 21-0781 to download Learn more about VA disability compensation for PTSD If you’re filing a claim for disability compensation online,you don’t need to submit this PDF form.We’ll ask you questions about your claim for PTSD when you fill out your online claim. If you’re filing a claim for disability compensation online,  When you file a claim for disability compensation, you’ll also need to submit this form: When you file a claim for disability compensation, you’ll also need to submit this form: A Statement in Support of Claim for Service Connection for Post-Traumatic Stress Disorder Secondary to Personal Assault (VA Form 21-0781a) Get VA Form 21-0781a to download Learn more about VA disability compensation for PTSD If you’re filing a claim for disability compensation online,you don’t need to submit this PDF form.We’ll ask you questions about your claim for PTSD when you fill out your online claim. If you’re filing a claim for disability compensation online,  When you file a claim for disability compensation, you’ll also need to submit this form: When you file a claim for disability compensation, you’ll also need to submit this form: An Application for Automobile or Other Conveyance and Adaptive Equipment (VA Form 21-4502) Get VA Form 21-4502 to download Learn more about special claims to get an automobile allowance When you file a claim for disability compensation, you’ll also need to submit this form: When you file a claim for disability compensation, you’ll also need to submit this form: An Application for Adaptive Equipment—Motor Vehicle (VA Form 10-1394) Get VA Form 10-1394 to download Learn more about special claims to get adaptive equipment for your vehicle When you file a claim for disability compensation, you’ll also need to submit this form: When you file a claim for disability compensation, you’ll also need to submit this form: An Application for Annual Clothing Allowance (VA Form 10-8678) Get VA Form 10-8678 to download Learn more about special claims to get a clothing allowance",40,"What forms are required to be submitted when filing a claim for disability compensation, and where can they be obtained?","When filing a claim for disability compensation, several forms need to be submitted depending on the specific circumstances. These forms include the Veteran’s Application for Increased Compensation Based on Unemployability (VA Form 21-8940), Request for Employment Information in Connection with Claim for Disability Benefits (VA Form 21-4192), Statement in Support of Claim for Service Connection for Post-Traumatic Stress Disorder (VA Form 21-0781), Statement in Support of Claim for Service Connection for Post-Traumatic Stress Disorder Secondary to Personal Assault (VA Form 21-0781a), Application for Automobile or Other Conveyance and"
41,https://www.va.gov/disability/how-to-file-claim/evidence-needed/fully-developed-claims/,Fully Developed Claims program. disability how to file claim evidence needed fully developed claims,"If you want to get a faster decision on your disability benefits claim by submitting evidence along with your claim, use the Fully Developed Claims program. Find out how to submit a fully developed claim. And learn what evidence you’ll need to submit along with your claim.",41,"What is the Fully Developed Claims program for disability benefits, and what evidence is needed to file a claim through this program?","The Fully Developed Claims program is designed to expedite the decision-making process for disability benefits claims by allowing claimants to submit all necessary evidence along with their initial claim. To file a claim through this program, you will need to submit all relevant medical records, test results, and other documentation that support your disability claim. By providing comprehensive evidence upfront, the goal is to reduce the time it takes for the Social Security Administration to make a decision on your claim."
42,https://www.va.gov/disability/how-to-file-claim/evidence-needed/fully-developed-claims/,What do I need to do to submit a fully developed claim?. disability how to file claim evidence needed fully developed claims,"Here’s what you’ll need to do for us to consider your claim fully developed: Here’s what you’ll need to do for us to consider your claim fully developed: Submit your completedApplication for Disability Compensation and Related Compensation Benefits (VA Form 21-526EZ),and and Submit all the evidence (supporting documents) you have along with your claim,and and Certify that there’s no more evidence we might need to decide your claim,and and Go to any VA medical exams that we schedule, if we decide these exams are needed to make a decision on your claim",42,What are the steps needed to submit a fully developed claim for disability compensation to the VA?,"To submit a fully developed claim for disability compensation to the VA, you will need to complete the Application for Disability Compensation and Related Compensation Benefits (VA Form 21-526EZ). Additionally, you must submit all the evidence (supporting documents) you have along with your claim, certify that there's no more evidence needed for a decision, and attend any VA medical exams scheduled if deemed necessary for the claim. These steps are crucial in ensuring your claim is fully developed and can be processed efficiently by the VA."
43,https://www.va.gov/disability/how-to-file-claim/evidence-needed/fully-developed-claims/,What evidence will I need to submit along with my disability claim?. disability how to file claim evidence needed fully developed claims,"You’ll need to submit this evidence: You’ll need to submit this evidence: All private medical records related to the claimed condition, like reports from your own doctor or X-rays or other test results from a non-VA hospital or other treatment center,and and Any records of medical treatment you’ve received for the claimed condition while serving in the military,and and Any military personnel records you have that relate to the claimed condition,and and Information about any related health records that you don’t have but that we can request on your behalf from a federal facility like a VA medical center or clinic If you think your service records don’t include a description of your disability, you can also submit letters from family members, friends, clergy members, law enforcement personnel, or those you served with that can tell us more about your claimed condition and how and when it happened. If you think your service records don’t include a description of your disability Note:In 1973, a fire at the National Personnel Records Center (NPRC) in St. Louis destroyed records held for Veterans who were discharged from the Army and Air Force during certain periods of time. If your records were destroyed in this fire, you can get help reconstructing them. Note: Find out how to reconstruct your records",43,"not enough values to unpack (expected 2, got 1)",N/A
44,https://www.va.gov/disability/how-to-file-claim/evidence-needed/fully-developed-claims/,Are there any risks to using the Fully Developed Claims program?. disability how to file claim evidence needed fully developed claims,"No. Filing a fully developed claim won’t affect the attention we give to your claim or the benefits you’re entitled to receive. If we determine that we need other non-federal records to make a decision on your claim, we’ll simply remove the claim from the Fully Developed Claims program and process it as a standard claim.",44,What are the risks associated with using the Fully Developed Claims program for filing disability claims and what happens if additional evidence is needed for the claim?,"There are no risks to using the Fully Developed Claims program for filing disability claims. Filing a fully developed claim will not impact the attention given to your claim or the benefits you are entitled to receive. If it is determined that additional non-federal records are needed to make a decision on your claim, the claim will be removed from the Fully Developed Claims program and processed as a standard claim."
45,https://www.va.gov/disability/how-to-file-claim/evidence-needed/fully-developed-claims/,What should the evidence show to support my disability claim?. disability how to file claim evidence needed fully developed claims,This depends on the type of claim you’re filing. Check what evidence is needed for different types of claims,45,What evidence is needed to support a disability claim and how can I ensure my claim is fully developed?,"The evidence needed to support a disability claim will vary depending on the type of claim being filed. It is important to check what evidence is specifically required for the type of claim you are filing. In general, evidence such as medical records, doctor's notes, test results, and any other documentation that proves the existence and severity of your disability will be necessary. To ensure your claim is fully developed, it is crucial to gather all relevant evidence and submit it with your claim to support your case. Additionally, following the proper procedures for filing a disability claim and providing any additional information requested by the disability claims process will help in having a fully developed"
46,https://www.va.gov/disability/how-to-file-claim/evidence-needed/fully-developed-claims/,Can VA help me gather evidence?. disability how to file claim evidence needed fully developed claims,"Yes. We can help you gather evidence for the Fully Developed Claims program in these ways: We’ll request your military service records (with your permission),and and We’ll request relevant Social Security benefits information and medical records that you identify and authorize us to get from a federal facility, like a VA medical center,and and We’ll schedule a health exam for you or get a medical opinion from a health care provider if we decide we need it for your claim Note:Even though we’ll gather federal records (like your DD214 or VA medical records) on your behalf, we encourage you to submit these if you have them to save time in the process. Note:",46,How can the VA help in gathering evidence for a disability claim?,"The VA can help gather evidence for a disability claim through the Fully Developed Claims program. This includes requesting military service records with permission, requesting relevant Social Security benefits information and medical records from federal facilities like VA medical centers, and scheduling a health exam or obtaining a medical opinion if necessary. While the VA can gather federal records on behalf of the individual, it is encouraged to submit these records if available to expedite the process."
47,https://www.va.gov/disability/how-to-file-claim/evidence-needed/fully-developed-claims/,When should I turn in my evidence?. disability how to file claim evidence needed fully developed claims,"You’ll need to turn in your evidence at the same time as you file your claim. If you’re filing online, upload your medical evidence or supporting documents at the end of the disability compensation form. If you turn in more information or evidence after you submit your fully developed claim, we’ll remove your claim from the FDC program and process it as a standard claim.",47,When should evidence be submitted when filing a disability claim?,"Evidence should be submitted at the same time as the disability claim is filed. If filing online, medical evidence or supporting documents should be uploaded at the end of the disability compensation form. It is important to submit all necessary evidence when filing a fully developed claim to avoid having it removed from the FDC program and processed as a standard claim."
48,https://www.va.gov/disability/how-to-file-claim/evidence-needed/fully-developed-claims/,How do I file a fully developed claim?. disability how to file claim evidence needed fully developed claims,"You can file a fully developed claim online, by mail, by fax, in person, or with the help of a trained professional. Find out how to file a fully developed claim for disability compensation",48,How can one file a fully developed claim for disability compensation and what are the different ways this can be done?,"You can file a fully developed claim for disability compensation online, by mail, by fax, in person, or with the help of a trained professional. The key information in the paragraph is the various methods available for filing a fully developed claim. By utilizing one of these methods, individuals can provide the necessary evidence needed for their claim efficiently and effectively."
49,https://www.va.gov/disability/how-to-file-claim/evidence-needed/fully-developed-claims/,Should I work with a Veterans Service Organization (VSO) representative to file my claim?. disability how to file claim evidence needed fully developed claims,"You don’t have to, but we encourage you to work with an accredited VSO representative. These trained professionals can help you file your claim and gather the needed medical records and evidence. Get help filing a claim",49,Why should I consider working with a Veterans Service Organization (VSO) representative when filing my disability claim and what assistance can they provide?,"Working with a Veterans Service Organization (VSO) representative when filing your disability claim can be beneficial as these trained professionals can help you gather the necessary medical records and evidence needed to support your claim. They can also assist in fully developing your claim to ensure all relevant information is included. While it is not required to work with a VSO representative, their expertise can help increase the likelihood of a successful claim submission."
50,https://www.va.gov/disability/how-to-file-claim/evidence-needed/fully-developed-claims/,Should I submit an intent to file?. disability how to file claim evidence needed fully developed claims,"If you’re not ready to file your claim yet, you may want to submit an intent to file. This sets a potential start date (or effective date) for your benefits, so you may be able to get retroactive payments. These are back payments for the time between when you submitted your intent to file and when we approved your claim. Find out how to submit an intent to file",50,What is the purpose of submitting an intent to file for disability benefits and what potential benefit does it offer?,"Submitting an intent to file for disability benefits allows you to establish a potential start date for your benefits, enabling you to potentially receive retroactive payments. Retroactive payments are back payments for the time between when you submitted your intent to file and when your claim is approved. This process ensures that you do not miss out on any potential benefits during the claims process."
51,https://www.va.gov/disability/how-to-file-claim/when-to-file/,Types of disability claims and when to file. disability how to file claim when to file,Find out when you can file your first claim for service-connected benefits. And learn what to do if you want to request more benefits or have new evidence to support a claim we denied in the past.,51,What are the two main types of disability claims and when should you file them?,"The two main types of disability claims are the first claim for service-connected benefits and requesting more benefits or providing new evidence for a previously denied claim. For the first claim for service-connected benefits, you should file as soon as you believe you are eligible based on your disability. If you want to request more benefits or have new evidence to support a previously denied claim, you should file as soon as possible after receiving the denial or when you have new evidence to support your claim."
52,https://www.va.gov/disability/how-to-file-claim/evidence-needed/,Evidence needed for your disability claim. disability how to file claim evidence needed,"When you file a disability claim, we review all available evidence (supporting documents) to determine if you’re eligible for benefits. Find out what evidence you’ll need. And learn about your options for gathering documents to support your claim.",52,What does the process of reviewing evidence entail when filing a disability claim?,"When filing a disability claim, the process of reviewing evidence involves examining all available supporting documents to assess eligibility for benefits. This includes analyzing medical records, work history, and any other relevant information to determine the extent of the disability and its impact on the individual's ability to work. By thoroughly reviewing the evidence, the claims examiner can make an informed decision on the disability claim."
